{
    "pattern_id": "INDEX_OPTION_DEMO",
    "regime_config": {
        "SIDEWAYS": {
            "allow_entry": true,
            "quantity_mod": 1.0,
            "tp_mult": 1.0,
            "buffer_atr": 0.5
        },
        "BULLISH": {
            "allow_entry": true,
            "quantity_mod": 1.0,
            "tp_mult": 1.0,
            "buffer_atr": 0.5
        },
        "BEARISH": {
            "allow_entry": true,
            "quantity_mod": 1.0,
            "tp_mult": 1.0,
            "buffer_atr": 0.5
        }
    },
    "phases": [
        {
            "id": "TRIGGER",
            "conditions": [
                "close > 0"
            ],
            "capture": {},
            "timeout": 0
        }
    ],
    "execution": {
        "side": "BUY",
        "entry": "close",
        "sl": "low - 50.0",
        "tp": "entry + 100.0",
        "option_selection": "ATM_CALL"
    }
}