{
    "pattern_id": "RSI_SCALPER_LONG",
    "regime_config": {
        "SIDEWAYS": {
            "allow_entry": true,
            "quantity_mod": 1.0,
            "tp_mult": 1.5
        },
        "BULLISH": {
            "allow_entry": true,
            "quantity_mod": 1.5,
            "tp_mult": 2.5
        }
    },
    "phases": [
        {
            "id": "OVERSOLD",
            "conditions": [
                "rsi(history, 14) < 30"
            ],
            "capture": {},
            "timeout": 0
        },
        {
            "id": "RECOVERY",
            "conditions": [
                "rsi(history, 14) > 35",
                "close > open"
            ],
            "capture": {},
            "timeout": 5
        }
    ],
    "execution": {
        "side": "BUY",
        "entry": "close",
        "sl": "lowest(history, 3, 'low')",
        "tp": "close + (close - sl) * 2.0",
        "option_selection": "ATM_CALL"
    }
}