{
    "pattern_id": "RSI_SCALPER_SHORT",
    "regime_config": {
        "SIDEWAYS": {
            "allow_entry": true,
            "quantity_mod": 1.0,
            "tp_mult": 1.5
        },
        "BEARISH": {
            "allow_entry": true,
            "quantity_mod": 1.5,
            "tp_mult": 2.5
        }
    },
    "phases": [
        {
            "id": "OVERBOUGHT",
            "conditions": [
                "rsi(history, 14) > 70"
            ],
            "capture": {},
            "timeout": 0
        },
        {
            "id": "REJECTION",
            "conditions": [
                "rsi(history, 14) < 65",
                "close < open"
            ],
            "capture": {},
            "timeout": 5
        }
    ],
    "execution": {
        "side": "SELL",
        "entry": "close",
        "sl": "highest(history, 3, 'high')",
        "tp": "close - (sl - close) * 2.0",
        "option_selection": "ATM_PUT"
    }
}